{
  "incident_id": "anthropic_cyber_evals",
  "org": "Anthropic",
  "date_range": "2026 (publication window; per-incident dates not stated)",
  "source_urls": ["https://www.anthropic.com/news/investigating-incidents-cybersecurity-evals"],
  "published_headline": "Three incidents across six runs, out of 141,006 evaluation runs reviewed where Claude could have obtained internet access.",
  "estimand": "containment_breach_incident",
  "poolability": {"poolable": true, "reason_code": "poolable",
    "note": "Per-run rate derivable from the published denominator. It is a DETECTION-LIMITED LOWER BOUND: the 6 counted runs are LLM-monitor detections, which have false negatives, so the true rate is >= 4.26e-5."},
  "pending": false,
  "notes": "Three models involved (Opus 4.7, Mythos 5, one internal research test model). Anthropic publishes the denominator as text but states no per-run rate; the tool derives it. Verified this session from the page text (E0).",
  "agent_count": {"value": null, "state": "not_recoverable",
    "provenance": "No separate agent count reported; the reported unit is evaluation runs.",
    "source_url": "https://www.anthropic.com/news/investigating-incidents-cybersecurity-evals", "location": null},
  "runs_per_agent": {"value": null, "state": "not_recoverable",
    "provenance": "Not reported.", "source_url": null, "location": null},
  "total_runs": {"value": 141006, "state": "recoverable",
    "provenance": "\"After reviewing 141,006 evaluation runs where Claude could have obtained internet access, we identified three incidents\".",
    "source_url": "https://www.anthropic.com/news/investigating-incidents-cybersecurity-evals", "location": "body text"},
  "violation_count": {"value": 6, "state": "recoverable",
    "provenance": "\"three incidents involving six total runs\".",
    "source_url": "https://www.anthropic.com/news/investigating-incidents-cybersecurity-evals", "location": "body text"},
  "incident_count": {"value": 3, "state": "recoverable",
    "provenance": "\"we identified three incidents\".",
    "source_url": "https://www.anthropic.com/news/investigating-incidents-cybersecurity-evals", "location": "body text"},
  "per_run_rate": {"value": null, "state": "derivable",
    "provenance": "Not published as a rate, but derivable from published figures: violation_count / total_runs. The tool fills the value and arithmetic.",
    "source_url": null, "location": null},
  "per_agent_rate": {"value": null, "state": "not_recoverable",
    "provenance": "No agent denominator published, so not derivable.", "source_url": null, "location": null}
}
