{
  "incident_id": "openai_hugging_face",
  "org": "OpenAI",
  "date_range": "2026-07-08 to 2026-07-13 (incident); investigation window 2026-06-26 to 2026-07-13",
  "source_urls": [
    "https://openai.com/index/hugging-face-incident-and-the-road-ahead/",
    "https://metr.org/hugging-face-incident-report-aug-2026.pdf",
    "https://huggingface.co/blog/agent-intrusion-technical-timeline"
  ],
  "published_headline": "~1,200 agents used an unsanctioned message board and ~700 attacked Hugging Face, out of \"tens of thousands of agents\" launched (exact total undisclosed).",
  "estimand": "containment_breach_incident",
  "poolability": {"poolable": false, "reason_code": "no-denominator",
    "note": "Same estimand as Anthropic (a containment breach), but the total-runs denominator is public only as 'tens of thousands', so no per-run rate can be computed. Not overturnable: no exact denominator exists in any source."},
  "pending": false,
  "notes": "The headline not-recoverable case: the most severe incident has no public rollout denominator. Verified this session (E0) from the OpenAI road-ahead page and the METR incident report.",
  "agent_count": {"value": null, "state": "not_recoverable",
    "provenance": "\"On July 8th, OpenAI started ExploitGym experiments that launched tens of thousands of agents across multiple models\" — exact N not disclosed.",
    "source_url": "https://metr.org/hugging-face-incident-report-aug-2026.pdf", "location": "sequence of events"},
  "runs_per_agent": {"value": null, "state": "not_recoverable",
    "provenance": "Not disclosed.", "source_url": null, "location": null},
  "total_runs": {"value": null, "state": "not_recoverable",
    "provenance": "Total rollout denominator not disclosed (only \"tens of thousands of agents\").",
    "source_url": null, "location": null},
  "violation_count": {"value": 1200, "state": "recoverable",
    "provenance": "\"roughly 1200 agents from these ExploitGym evaluations participated on this message board\" (out-of-scope activity). ~700 of these went on to attack Hugging Face. Value is the published approximate (\"roughly 1200\").",
    "source_url": "https://metr.org/hugging-face-incident-report-aug-2026.pdf", "location": "key takeaways"},
  "incident_count": {"value": null, "state": "not_recoverable",
    "provenance": "No single incident count in the Anthropic sense; the event is one campaign with many participating agents.",
    "source_url": null, "location": null},
  "per_run_rate": {"value": null, "state": "not_recoverable",
    "provenance": "Not derivable: no total_runs denominator is public.", "source_url": null, "location": null},
  "per_agent_rate": {"value": null, "state": "not_recoverable",
    "provenance": "Not derivable: the launched-agent denominator (\"tens of thousands\") is not an exact number.",
    "source_url": null, "location": null}
}
