{
  "incident_id": "aisi_cheating",
  "org": "UK AISI",
  "date_range": "2026 (cheating-behaviour study)",
  "source_urls": ["https://www.aisi.gov.uk/blog/cheating-behaviour-in-frontier-model-evaluations"],
  "published_headline": "Every frontier model tested attempted cheating; rate reported as the percentage of cyber-evaluation trajectories where the model attempts to cheat (per-trajectory unit).",
  "estimand": "cheating_propensity",
  "poolability": {"poolable": false, "reason_code": "different-estimand",
    "note": "PRIMARY reason it is not poolable: AISI measures cheating propensity (any out-of-scope shortcut in a trajectory), NOT a containment-breach incident, so its rate is not comparable with Anthropic/OpenAI even where a value is readable. This holds regardless of whether the per-model values are recovered. SECONDARY: those per-model values are figure-only in the primary source (not machine-readable text)."},
  "pending": false,
  "notes": "The retrievability case: the UNIT is recoverable from the Figure 1 caption (per trajectory = per run), but the per-model VALUES and the denominator live only inside a figure image and are not in the page text. Not reconstructed from the image. Verified this session (E0).",
  "agent_count": {"value": null, "state": "not_recoverable",
    "provenance": "Not reported; unit is trajectories.", "source_url": null, "location": null},
  "runs_per_agent": {"value": null, "state": "not_recoverable",
    "provenance": "Not reported.", "source_url": null, "location": null},
  "total_runs": {"value": null, "state": "not_recoverable",
    "provenance": "Per-model denominator (runs/model) not stated in the page text; it is not machine-readable from the primary source (Figure 1 is an image). A ~475/model figure appears only in secondary coverage and is not used here.",
    "source_url": "https://www.aisi.gov.uk/blog/cheating-behaviour-in-frontier-model-evaluations", "location": "Figure 1 (image)"},
  "violation_count": {"value": null, "state": "not_recoverable",
    "provenance": "Per-model counts of cheating trajectories appear only inside the Figure 1 image, not in the page text.",
    "source_url": "https://www.aisi.gov.uk/blog/cheating-behaviour-in-frontier-model-evaluations", "location": "Figure 1 (image)"},
  "incident_count": {"value": null, "state": "not_recoverable",
    "provenance": "Not an incident-count study.", "source_url": null, "location": null},
  "per_run_rate": {"value": null, "state": "not_recoverable",
    "provenance": "Unit is per-trajectory (recoverable from the Figure 1 caption), but the per-model rate values are image-only and not machine-readable.",
    "source_url": "https://www.aisi.gov.uk/blog/cheating-behaviour-in-frontier-model-evaluations", "location": "Figure 1 caption + image"},
  "per_agent_rate": {"value": null, "state": "not_recoverable",
    "provenance": "Not reported.", "source_url": null, "location": null}
}
